{
  "version": 1,
  "project_name": "NUCLEO-L476RG-generated",
  "generated_root": "generated",
  "project_toolchain": "STM32CubeIDE",
  "build_system": "cubeide",
  "default_configuration": "Debug",
  "board": {
    "name": "NUCLEO-L476RG",
    "mcu": "STM32L476RG",
    "interface": "SWD",
    "connect_defaults": {
      "port": "SWD",
      "frequency_khz": 4000,
      "mode": "NORMAL",
      "reset": "SWrst"
    }
  },
  "firmware": {
    "format": "elf",
    "ioc_path": "generated/NUCLEO-L476RG-generated/NUCLEO-L476RG-generated.ioc",
    "default_artifact": "C:\\stm32\\stm32agent\\generated\\NUCLEO-L476RG-generated\\STM32CubeIDE\\Debug\\NUCLEO-L476RG-generated.elf"
  },
  "cubemx": {
    "log_path": "C:/Users/anupd/.stm32cubemx/STM32CubeMX.log",
    "project_name": "NUCLEO-L476RG-generated",
    "project_toolchain": "STM32CubeIDE",
    "project_path": "C:\\stm32\\stm32agent\\generated\\NUCLEO-L476RG-generated",
    "script_path": "C:\\stm32\\stm32agent\\generated\\NUCLEO-L476RG-generated\\script.txt"
  },
  "build": {
    "import_project": true,
    "default_clean": true,
    "command": [
      "stm32cubeidec",
      "--launcher.suppressErrors",
      "-nosplash",
      "-consolelog",
      "-application",
      "org.eclipse.cdt.managedbuilder.core.headlessbuild"
    ],
    "system": "cubeide",
    "workspace": "C:\\stm32\\stm32agent\\generated\\.cubeide-workspace",
    "project_path": "C:\\stm32\\stm32agent\\generated\\NUCLEO-L476RG-generated\\STM32CubeIDE",
    "project_name": "NUCLEO-L476RG-generated",
    "default_configuration": "Debug",
    "configurations": [
      "Debug"
    ],
    "artifact": "C:\\stm32\\stm32agent\\generated\\NUCLEO-L476RG-generated\\STM32CubeIDE\\Debug\\NUCLEO-L476RG-generated.elf"
  },
  "debug": {
    "server": "stlink-gdb-server",
    "gdb_port": 55001,
    "swo_port": 55002,
    "elf_path": "C:\\stm32\\stm32agent\\generated\\NUCLEO-L476RG-generated\\STM32CubeIDE\\Debug\\NUCLEO-L476RG-generated.elf"
  }
}
